mysql> use saveetha;
Database changed
mysql> show tables;
+--------------------+
| Tables_in_saveetha |
+--------------------+
| authors            |
| book_company       |
| car                |
| company            |
| cost               |
| doctor             |
| empdept            |
| employees          |
| grades             |
| marks              |
| marks_view         |
| mdept              |
| mentee             |
| mentees            |
| movie              |
| movies             |
| patients           |
| per                |
| pharmacy           |
| room_accomodation  |
| store              |
| student            |
| students           |
| studepartment      |
+--------------------+
24 rows in set (0.00 sec)

mysql>  create table employee(Emp_id int(4),Emp_name varchar(20),DOB DATE,DOJ DATE,Salary int(4),Address varchar(20),Experience int(1));
Query OK, 0 rows affected (0.01 sec)

mysql> desc employee;
+------------+-------------+------+-----+---------+-------+
| Field      | Type        | Null | Key | Default | Extra |
+------------+-------------+------+-----+---------+-------+
| Emp_id     | int(4)      | YES  |     | NULL    |       |
| Emp_name   | varchar(20) | YES  |     | NULL    |       |
| DOB        | date        | YES  |     | NULL    |       |
| DOJ        | date        | YES  |     | NULL    |       |
| Salary     | int(4)      | YES  |     | NULL    |       |
| Address    | varchar(20) | YES  |     | NULL    |       |
| Experience | int(1)      | YES  |     | NULL    |       |
+------------+-------------+------+-----+---------+-------+
7 rows in set (0.02 sec)

mysql> insert into employee values(100,"Deepshika",'2023-01-31',100000,"Guntur",3);
ERROR 1136 (21S01): Column count doesn't match value count at row 1
mysql> insert into employee values(100,"Deepshika",'2000-03-07','2022-07-03',10000,"Ongole",3);
Query OK, 1 row affected (0.03 sec)

mysql> insert into employee values(101,"Harini",'2001-06-23','2021-07-16',20000,"vij",4);
Query OK, 1 row affected (0.00 sec)

mysql> insert into employee values(102,"Lavanya",'2004-05-23','2021-09-23',10000,"Ongole",3);
Query OK, 1 row affected (0.00 sec)

mysql> insert into employee values(103,"Dharika",'2004-07-19','2021-05-25',10000,"Hyd",2);
Query OK, 1 row affected (0.02 sec)

mysql> insert into employee values(104,"Teju",'2003-05-22','2023-01-01',10000,"Tirupati",2);
Query OK, 1 row affected (0.01 sec)

mysql> select*from employee;
+--------+-----------+------------+------------+--------+----------+------------+
| Emp_id | Emp_name  | DOB        | DOJ        | Salary | Address  | Experience |
+--------+-----------+------------+------------+--------+----------+------------+
|    100 | Deepshika | 2000-03-07 | 2022-07-03 |  10000 | Ongole   |          3 |
|    101 | Harini    | 2001-06-23 | 2021-07-16 |  20000 | vij      |          4 |
|    102 | Lavanya   | 2004-05-23 | 2021-09-23 |  10000 | Ongole   |          3 |
|    103 | Dharika   | 2004-07-19 | 2021-05-25 |  10000 | Hyd      |          2 |
|    104 | Teju      | 2003-05-22 | 2023-01-01 |  10000 | Tirupati |          2 |
+--------+-----------+------------+------------+--------+----------+------------+
5 rows in set (0.02 sec)

mysql> update employee set Salary=50000 where Address="Ongole";
Query OK, 2 rows affected (0.00 sec)
Rows matched: 2  Changed: 2  Warnings: 0

mysql> update employee set Salary=30000 where Address="Hyd";
Query OK, 1 row affected (0.03 sec)
Rows matched: 1  Changed: 1  Warnings: 0

mysql> select*from employee;
+--------+-----------+------------+------------+--------+----------+------------+
| Emp_id | Emp_name  | DOB        | DOJ        | Salary | Address  | Experience |
+--------+-----------+------------+------------+--------+----------+------------+
|    100 | Deepshika | 2000-03-07 | 2022-07-03 |  50000 | Ongole   |          3 |
|    101 | Harini    | 2001-06-23 | 2021-07-16 |  20000 | vij      |          4 |
|    102 | Lavanya   | 2004-05-23 | 2021-09-23 |  50000 | Ongole   |          3 |
|    103 | Dharika   | 2004-07-19 | 2021-05-25 |  30000 | Hyd      |          2 |
|    104 | Teju      | 2003-05-22 | 2023-01-01 |  10000 | Tirupati |          2 |
+--------+-----------+------------+------------+--------+----------+------------+
5 rows in set (0.00 sec)

mysql> create table Edept(Dept_id int(4),Dept_name varchar(20),no_of_persons int(4));
Query OK, 0 rows affected (0.04 sec)

mysql> insert into Edept values
    -> (1,"Sales",30);
Query OK, 1 row affected (0.00 sec)

mysql> insert into Edept values(2,"HR",10);
Query OK, 1 row affected (0.00 sec)

mysql> insert into Edept values(3,"Manufacturing",40);
Query OK, 1 row affected (0.02 sec)

mysql> insert into Edept values(4,"Accounts",20);
Query OK, 1 row affected (0.03 sec)

mysql> select*from Edept;
+---------+---------------+---------------+
| Dept_id | Dept_name     | no_of_persons |
+---------+---------------+---------------+
|       1 | Sales         |            30 |
|       2 | HR            |            10 |
|       3 | Manufacturing |            40 |
|       4 | Accounts      |            20 |
+---------+---------------+---------------+
4 rows in set (0.00 sec)

mysql> select sum(Salary),min(Salary),max(Salary),avg(Salary) from employee;
+-------------+-------------+-------------+-------------+
| sum(Salary) | min(Salary) | max(Salary) | avg(Salary) |
+-------------+-------------+-------------+-------------+
|      160000 |       10000 |       50000 |  32000.0000 |
+-------------+-------------+-------------+-------------+
1 row in set (0.02 sec)

mysql> select Emp_name,Salary from employee where Emp_id=102;
+----------+--------+
| Emp_name | Salary |
+----------+--------+
| Lavanya  |  50000 |
+----------+--------+
1 row in set (0.00 sec)

mysql> select Emp_name,Salary from employee where Experience=3;
+-----------+--------+
| Emp_name  | Salary |
+-----------+--------+
| Deepshika |  50000 |
| Lavanya   |  50000 |
+-----------+--------+
2 rows in set (0.00 sec)

mysql> delete from employee where Emp_id=5;
Query OK, 0 rows affected (0.00 sec)

mysql> select*from employee;
+--------+-----------+------------+------------+--------+----------+------------+
| Emp_id | Emp_name  | DOB        | DOJ        | Salary | Address  | Experience |
+--------+-----------+------------+------------+--------+----------+------------+
|    100 | Deepshika | 2000-03-07 | 2022-07-03 |  50000 | Ongole   |          3 |
|    101 | Harini    | 2001-06-23 | 2021-07-16 |  20000 | vij      |          4 |
|    102 | Lavanya   | 2004-05-23 | 2021-09-23 |  50000 | Ongole   |          3 |
|    103 | Dharika   | 2004-07-19 | 2021-05-25 |  30000 | Hyd      |          2 |
|    104 | Teju      | 2003-05-22 | 2023-01-01 |  10000 | Tirupati |          2 |
+--------+-----------+------------+------------+--------+----------+------------+
5 rows in set (0.00 sec)

mysql>
